id,title,time,date,link
,Posture of the Navy,09:30AM,03/05/20," https://www.armed-services.senate.gov/hearings/20-03-05-posture-of-the-navy- "
,Navy Shipbuilding Programs,10:00AM,03/04/20," https://www.armed-services.senate.gov/hearings/20-03-04-navy-shipbuilding-programs- "
,CLOSED: United States European Command and United States Transportation Command,02:30PM,02/25/20," https://www.armed-services.senate.gov/hearings/20-02-25-united-states-european-command-and-united-states-transportation-command-b "
,United States European Command and United States Transportation Command,09:30AM,02/25/20," https://www.armed-services.senate.gov/hearings/20-02-25-united-states-european-command-and-united-states-transportation-command "
,United States Northern Command and United States Strategic Command,09:30AM,02/13/20," https://www.armed-services.senate.gov/hearings/20-02-13-united-states-northern-command-and-united-states-strategic-command "
,United States Strategy in Afghanistan,09:30AM,02/11/20," https://www.armed-services.senate.gov/hearings/20-02-11-united-states-strategy-in-afghanistan "
,POSTPONED: United States Special Operations Command and United States Cyber Command,10:00AM,02/06/20," https://www.armed-services.senate.gov/hearings/20-02-06-united-states-special-operations-command-and-united-states-cyber-command "
,United States Africa Command and United States Southern Command,09:00AM,01/30/20," https://www.armed-services.senate.gov/hearings/20-01-30-united-states-africa-command-and-united-states-southern-command "
,POSTPONED: United States Strategy in Afghanistan,09:00AM,01/28/20," https://www.armed-services.senate.gov/hearings/20-01-28-united-states-strategy-in-afghanistan "
,Nominations -- McPherson -- Williams,09:00AM,01/16/20," https://www.armed-services.senate.gov/hearings/20-01-16-nominations_--mcpherson----williams "
,CLOSED: Situation and U.S. Strategy in Afghanistan,02:30PM,12/11/19," https://www.armed-services.senate.gov/hearings/19-12-11-situation-and-us-strategy-in-afghanistan "
,"Strategic Threats, Ongoing Challenges, and National Defense Strategy Implementation",09:30AM,12/05/19," https://www.armed-services.senate.gov/hearings/19-12-05-strategic-threats-ongoing-challenges-and-national-defense-strategy-implementation "
,"Servicemember, Family, and Veteran Suicides and Prevention Strategies",03:00PM,12/04/19," https://www.armed-services.senate.gov/hearings/19-12-04-servicemember-family-and-veteran-suicides-and-prevention-strategies "
,United States Navy Ship and Submarine Maintenance,10:00AM,12/04/19," https://www.armed-services.senate.gov/hearings/19-12-04-united-states-navy-ship-and-submarine-maintenance "
,Government Accountability Office on Privatized Housing Findings to Include Responses from the Military Services on Ongoing Reports of Substandard Housing Conditions and Services,09:30AM,12/03/19," https://www.armed-services.senate.gov/hearings/19-12-03-government-accountability-office-on-privatized-housing-findings-to-include-responses-from-the-military-services-on-ongoing-reports-of-substandard-housing-conditions-and-services "
,Biological Threats to U.S. National Security,03:00PM,11/20/19," https://www.armed-services.senate.gov/hearings/19-11-20-biological-threats-to-us-national-security "
,CLOSED: Implementation of the 2018 Department of Defense Cyber Strategy,02:30PM,11/20/19," https://www.armed-services.senate.gov/hearings/19-11-20-implementation-of-the-2018-department-of-defense-cyber-strategy "
,Department of Defense Audit,09:30AM,11/20/19," https://www.armed-services.senate.gov/hearings/19-11-20-department-of-defense-audit "
,POSTPONED: CLOSED: Department of Defense Cyber Operations,02:30PM,10/30/19," https://www.armed-services.senate.gov/hearings/19-10-30-department-of-defense-cyber-operations "
,Nominations -- Hershman -- Deasy -- Sander,09:30AM,10/29/19," https://www.armed-services.senate.gov/hearings/19-10-29-nominations_--hershman----deasy----sander "
,Nomination -- Richard,09:00AM,10/24/19," https://www.armed-services.senate.gov/hearings/19-10-24-nomination_--richard "
,CLOSED: U.S. Navy’s “Spectrum of Conflict” Strategic Framework,10:00AM,10/23/19," https://www.armed-services.senate.gov/hearings/19-10-23-us-navys-spectrum-of-conflict-strategic-framework "
,CLOSED: Situation in Syria and the Wider Region,09:00AM,10/17/19," https://www.armed-services.senate.gov/hearings/19-10-17-situation-in-syria-and-the-wider-region "
,Situation in Southeastern Europe,03:00PM,09/17/19," https://www.armed-services.senate.gov/hearings/19-09-17-situation-in-southeastern-europe "
,Nominations -- McCarthy - Barrett,09:30AM,09/12/19," https://www.armed-services.senate.gov/hearings/19-09-12-nominations_--mccarthy---barrett "
,Nomination -- Gilday,09:30AM,07/31/19," https://www.armed-services.senate.gov/hearings/19-07-30-nomination_--gilday "
,Nomination -- Hyten,10:00AM,07/30/19," https://www.armed-services.senate.gov/hearings/19-07-30-nomination_--hyten "
,Nomination -- Norquist,10:00AM,07/24/19," https://www.armed-services.senate.gov/hearings/19-07-24-nomination_--norquist "
,Nomination -- Esper,09:30AM,07/16/19," https://www.armed-services.senate.gov/hearings/19-07-16-nomination_--esper "
,Nomination -- Milley,09:30AM,07/11/19," https://www.armed-services.senate.gov/hearings/19-07-11-nomination_--milley "
,Implementation of the National Defense Strategy in the United States Southern Command Area of Responsibility,03:00PM,07/09/19," https://www.armed-services.senate.gov/hearings/19-07-09-implementation-of-the-national-defense-strategy-in-the-united-states-southern-command-area-of-responsibility "
,CLOSED: Iranian Threats and U.S. Policy Responses,02:00PM,06/19/19," https://www.armed-services.senate.gov/hearings/19-06-19-iranian-threats-and-us-policy-responses "
,Nominations -- Scolese - Raymond,09:30AM,06/04/19," https://www.armed-services.senate.gov/hearings/19-06-04-nominations_--scolese---raymond "
,CLOSED: SCHEDULE FOR ARMED SERVICES FULL COMMITTEE MARKUP OF THE NATIONAL DEFENSE AUTHORIZATION ACT FOR FISCAL YEAR 2020,09:00AM,05/22/19," https://www.armed-services.senate.gov/hearings/19-05-22-schedule-for-armed-services-full-committee-markup-of-the-national-defense-authorization-act-for-fiscal-year-2020 "
,ARCHIVED WEBCAST AND TRANSCRIPT OF THE MARKUP FOR THE SUBCOMMITTEE ON PERSONNEL FY 2020,02:15PM,05/21/19," https://www.armed-services.senate.gov/hearings/19-05-21-archived-webcast-and-transcript-of-the-markup-for-the-subcommittee-on-personnel-fy-2020 "
,OPEN/CLOSED: SCHEDULE FOR ARMED SERVICES SUBCOMMITTEE MARKUPS  OF THE NATIONAL DEFENSE AUTHORIZATION ACT FOR FISCAL YEAR 2020,04:00PM,05/20/19," https://www.armed-services.senate.gov/hearings/19-05-20-schedule-for-armed-services-subcommittee-markups_of-the-national-defense-authorization-act-for-fiscal-year-2020 "
,Department of Energy’s Atomic Defense Activities and Programs,02:30PM,05/08/19," https://www.armed-services.senate.gov/hearings/19-05-08-department-of-energys-atomic-defense-activities-and-programs "
,POSTPONED: CLOSED: The Navy’s 355-ship Requirement and Alternative Force Structure Options,02:30PM,05/07/19," https://www.armed-services.senate.gov/hearings/19-05-07-the-navys-355-ship-requirement-and-alternative-force-structure-options "
,Nomination -- McConville,09:30AM,05/02/19," https://www.armed-services.senate.gov/hearings/19-05-02-nomination_--mcconville "
,"U.S. Nuclear Weapons Policy, Programs, and Strategy",02:30PM,05/01/19," https://www.armed-services.senate.gov/hearings/19-05-01-us-nuclear-weapons-policy-programs-and-strategy "
,Nominations -- Moran - Berger,09:30AM,04/30/19," https://www.armed-services.senate.gov/hearings/19-04-30-nominations_--moran---berger "
,Proposal to Establish a United States Space Force,09:30AM,04/11/19," https://www.armed-services.senate.gov/hearings/19-04-11-proposal-to-establish-a-united-states-space-force "
,CLOSED: Defense Industrial Base Cybersecurity Policy,02:30PM,04/10/19," https://www.armed-services.senate.gov/hearings/19-04-10-defense-industrial-base-cybersecurity-policy "
,Marine Corps Ground Modernization and Naval Aviation Programs,10:00AM,04/10/19," https://www.armed-services.senate.gov/hearings/19-04-10-marine-corps-ground-modernization-and-naval-aviation-programs "
,Air Force Modernization,03:00PM,04/09/19," https://www.armed-services.senate.gov/hearings/19-04-09-air-force-modernization "
,CLOSED: United States Special Operations Command’s Efforts to Transform the Force for Future Security Challenges and Implement the National Defense Strategy,02:30PM,04/09/19," https://www.armed-services.senate.gov/hearings/19-04-09-united-states-special-operations-commands-efforts-to-transform-the-force-for-future-security-challenges-and-implement-the-national-defense-strategy "
,Posture of the Department of the Navy,09:30AM,04/09/19," https://www.armed-services.senate.gov/hearings/19-04-09-posture-of-the-department-of-the-navy "
,Posture of the Department of the Air Force,09:30AM,04/04/19," https://www.armed-services.senate.gov/hearings/19-04-04-posture-of-the-department-of-the-air-force "
,POSTPONED: Navy and Marine Corps Aviation Programs,03:00PM,04/03/19," https://www.armed-services.senate.gov/hearings/19-04-03-navy-and-marine-corps-aviation-programs- "
,Missile Defense Policies and Programs,02:30PM,04/03/19," https://www.armed-services.senate.gov/hearings/19-04-03-missile-defense-policies-and-programs "
,Army Modernization,03:00PM,04/02/19," https://www.armed-services.senate.gov/hearings/19-04-02-army-modernization "
,Nominations -- Wolters - Townsend,09:30AM,04/02/19," https://www.armed-services.senate.gov/hearings/19-04-02-nominations_--wolters---townsend "
,Department of Energy’s Atomic Energy Defense Programs,09:30AM,03/28/19," https://www.armed-services.senate.gov/hearings/19-03-28-department-of-energys-atomic-energy-defense-programs "
,"Military Space Operations, Policy and Programs",02:30PM,03/27/19," https://www.armed-services.senate.gov/hearings/19-03-27-military-space-operations-policy-and-programs "
,Navy Shipbuilding Programs,10:00AM,03/27/19," https://www.armed-services.senate.gov/hearings/19-03-27-navy-shipbuilding-programs- "
,Cybersecurity Responsibilities of the Defense Industrial Base,02:30PM,03/26/19," https://www.armed-services.senate.gov/hearings/19-03-26-cybersecurity-responsibilities-of-the-defense-industrial-base "
,Posture of the Department of the Army,09:30AM,03/26/19," https://www.armed-services.senate.gov/hearings/19-03-26-posture-of-the-department-of-the-army "
,Department of Defense Budget Posture,09:30AM,03/14/19," https://www.armed-services.senate.gov/hearings/19-03-14-department-of-defense-budget-posture "
,CLOSED: The Most Significant Threats to U.S. Naval Forces and How U.S. Naval Forces Plan to Operate in a Contested Environment,10:30AM,03/13/19," https://www.armed-services.senate.gov/hearings/19-03-13-the-most-significant-threats-to-us-naval-forces-and-how-us-naval-forces-plan-to-operate-in-a-contested-environment "
,Artificial Intelligence Initiatives within the Department of Defense,02:30PM,03/12/19," https://www.armed-services.senate.gov/hearings/19-03-12-artificial-intelligence-initiatives-within-the-department-of-defense "
,Chain of Command’s Accountability to Provide Safe Military Housing and Other Building Infrastructure to Servicemembers and Their Families,09:30AM,03/07/19," https://www.armed-services.senate.gov/hearings/19-03-07-chain-of-commands-accountability-to-provide-safe-military-housing-and-other-building-infrastructure-to-servicemembers-and-their-families "
,Military Services’ Prevention of and Response to Sexual Assault,02:30PM,03/06/19," https://www.armed-services.senate.gov/hearings/19-03-06-military-services-prevention-of-and-response-to-sexual-assault "
,CLOSED: United States European Command and United States Transportation Command,02:30PM,03/05/19," https://www.armed-services.senate.gov/hearings/19-03-05-united-states-european-command-and-united-states-transportation-command-fy-2020 "
,United States European Command and United States Transportation Command,09:30AM,03/05/19," https://www.armed-services.senate.gov/hearings/19-03-05-united-states-european-command-and-united-states-transportation-command "
,Nuclear Policy and Posture,09:30AM,02/28/19," https://www.armed-services.senate.gov/hearings/19-02-28-nuclear-policy-and-posture "
,CLOSED: Department of Defense Cyber Operations,02:30PM,02/27/19," https://www.armed-services.senate.gov/hearings/19-02-27-department-of-defense-cyber-operations "
,Military Personnel Policies and Military Family Readiness,02:30PM,02/27/19," https://www.armed-services.senate.gov/hearings/19-02-27-military-personnel-policies-and-military-family-readiness "
,CLOSED: B-21 “Raider”,03:00PM,02/26/19," https://www.armed-services.senate.gov/hearings/19-02-26-b-21-raider "
,United States Strategic Command and United States Northern Command,09:30AM,02/26/19," https://www.armed-services.senate.gov/hearings/19-02-15-united-states-strategic-command-and-united-states-northern-command "
,United States Special Operations Command and United States Cyber Command,09:30AM,02/14/19," https://www.armed-services.senate.gov/hearings/19-02-14-united-states-special-operations-command-and-united-states-cyber-command "
,Current Condition of the Military Housing Privatization Initiative,02:00PM,02/13/19," https://www.armed-services.senate.gov/hearings/19-02-13-current-condition-of-the-military-housing-privatization-initiative "
,CLOSED: Cyber Operations to Defend the Midterm Elections,09:30AM,02/13/19," https://www.armed-services.senate.gov/hearings/19-02-13-cyber-operations-to-defend-the-midterm-elections "
,United States Indo-Pacific Command and United States Forces Korea,09:30AM,02/12/19," https://www.armed-services.senate.gov/hearings/19-02-12-united-states-indo-pacific-command-and-united-states-forces-korea "
,United States Africa Command and United States Southern Command,10:15AM,02/07/19," https://www.armed-services.senate.gov/hearings/19-02-07-united-states-africa-command-and-united-states-southern-command "
,CLOSED: Global Nuclear Developments,02:30PM,02/06/19," https://www.armed-services.senate.gov/hearings/19-02-06-global-nuclear-developments "
,CLOSED: United States Army Readiness,02:30PM,02/06/19," https://www.armed-services.senate.gov/hearings/19-02-06-united-states-army-readiness "
,POSTPONED: Worldwide Threats,10:00AM,02/06/19," https://www.armed-services.senate.gov/hearings/19-02-06-worldwide-threats "
,CLOSED: United States Central Command -- follow-up to the open hearing,02:15PM,02/05/19," https://www.armed-services.senate.gov/hearings/19-02-05-united-states-central-command_--follow-up-to-the-open-hearing "
,United States Central Command,09:30AM,02/05/19," https://www.armed-services.senate.gov/hearings/19-02-05-united-states-central-command "
,Department of Defense Enterprise-wide Cybersecurity Policies and Architecture,02:30PM,01/29/19," https://www.armed-services.senate.gov/hearings/19-01-29-department-of-defense-enterprise-wide-cybersecurity-policies-and-architecture "
,China and Russia,10:00AM,01/29/19," https://www.armed-services.senate.gov/hearings/19-01-29-china-and-russia "
,CLOSED: President Trump’s Recent Decision to Withdraw U.S. Forces from Syria,09:30AM,01/10/19," https://www.armed-services.senate.gov/hearings/19-01-10-president-trumps-recent-decision-to-withdraw-us-forces-from-syria "
,CLOSED: U.S. Force Posture in the Indo-Pacific Region,02:30PM,12/12/18," https://www.armed-services.senate.gov/hearings/18-12-12-us-force-posture-in-the-indo-pacific-region "
,United States Navy and Marine Corps Readiness,09:30AM,12/12/18," https://www.armed-services.senate.gov/hearings/18-12-05-united-states-navy-and-marine-corps-readiness "
,Implications of China’s Presence and Investment in Africa,09:30AM,12/12/18," https://www.armed-services.senate.gov/hearings/18-12-12-implications-of-chinas-presence-and-investment-in-africa "
,CLOSED: Recent Chinese and Russian Naval Activities,02:30PM,12/11/18," https://www.armed-services.senate.gov/hearings/18-12-11-recent-chinese-and-russian-naval-activities "
,CLOSED: Security Situation in Afghanistan,10:30AM,12/06/18," https://www.armed-services.senate.gov/hearings/18-12-06-security-situation-in-afghanistan "
,Nominations -- McKenzie - Clarke,09:30AM,12/04/18," https://www.armed-services.senate.gov/hearings/18-12-04-nominations_--mckenzie---clarke "
,Nominations -- McCaffery - Bookless,09:30AM,11/29/18," https://www.armed-services.senate.gov/hearings/18-11-29-nominations_--mccaffery---bookless "
,CLOSED: Cyber Command’s Relationship with the National Security Agency,02:30PM,11/28/18," https://www.armed-services.senate.gov/hearings/18-11-28-cyber-commands-relationship-with-the-national-security-agency "
,Navy Shipbuilding Programs,02:30PM,11/27/18," https://www.armed-services.senate.gov/hearings/18-11-27-navy-shipbuilding-programs "
,Findings and Recommendations of the Commission on the National Defense Strategy,09:30AM,11/27/18," https://www.armed-services.senate.gov/hearings/18-11-27-findings-and-recommendations-of-the-commission-on-the-national-defense-strategy "
,Department of Defense’s Cybersecurity Acquisition and Practices from the Private Sector,03:00PM,11/14/18," https://www.armed-services.senate.gov/hearings/18-11-14-department-of-defenses-cybersecurity-acquisition-and-practices-from-the-private-sector "
,POSTPONED: Implications of China’s Presence and Investment in Africa,03:00PM,10/17/18," https://www.armed-services.senate.gov/hearings/18-10-17-implications-of-chinas-presence-and-investment-in-africa "
,POSTPONED: Nominations -- McCaffery - Bookless,09:30AM,10/16/18," https://www.armed-services.senate.gov/hearings/18-10-16-nominations_--mccaffery---bookless "
,United States Air Force Readiness,09:30AM,10/10/18," https://www.armed-services.senate.gov/hearings/18-10-10-united-states-air-force-readiness "
,OPEN/CLOSED: Cyber Operational Readiness of the Department of Defense,02:30PM,09/26/18," https://www.armed-services.senate.gov/hearings/18-09-26-cyber-operational-readiness-of-the-department-of-defense "
,Nominations -- Abrams - Faller,09:30AM,09/25/18," https://www.armed-services.senate.gov/hearings/18-09-25-nominations_--abrams---faller "
,CLOSED: Interagency Coordination in the Protection of Critical Infrastructure,02:30PM,09/18/18," https://www.armed-services.senate.gov/hearings/18-09-18-interagency-coordination-in-the-protection-of-critical-infrastructure "
,Nominations -- Shaffer - Daigle - McMahon - Wardynski - Beehler,09:30AM,08/21/18," https://www.armed-services.senate.gov/hearings/18-08-21-nominations_--shaffer---daigle---mcmahon---wardynski---beehler "
,Nomination -- Lyons,09:30AM,06/26/18," https://www.armed-services.senate.gov/hearings/18-06-26-nomination_--lyons "
,Nomination -- Miller,09:30AM,06/19/18," https://www.armed-services.senate.gov/hearings/18-06-19-nomination_--miller "
,CLOSED: SCHEDULE FOR ARMED SERVICES FULL COMMITTEE MARKUP OF THE  NATIONAL DEFENSE AUTHORIZATION ACT FOR FISCAL YEAR 2019,09:30AM,05/23/18," https://www.armed-services.senate.gov/hearings/18-05-23-schedule-for-armed-services-full-committee-markup-of-the_national-defense-authorization-act-for-fiscal-year-2019 "
,ARCHIVED WEBCAST AND TRANSCRIPT OF THE MARKUP FOR THE SUBCOMMITTEE ON PERSONNEL FY 2019,02:30PM,05/22/18," https://www.armed-services.senate.gov/hearings/18-05-22-archived-webcast-and-transcript-of-the-markup-for-the-subcommittee-on-personnel-fy-2019 "
,OPEN/CLOSED: SCHEDULE FOR ARMED SERVICES SUBCOMMITTEE MARKUPS OF THE NATIONAL DEFENSE AUTHORIZATION ACT FOR FISCAL YEAR 2019,05:00PM,05/21/18," https://www.armed-services.senate.gov/hearings/18-05-21-schedule-for-armed-services-subcommittee-markups-of-the-national-defense-authorization-act-for-fiscal-year-2019 "
,Nominations -- Porter - Stewart - Anderson - Slavonic - Verdon,09:30AM,05/10/18," https://www.armed-services.senate.gov/hearings/18-05-10-nominations_porter--stewart--anderson--slavonic---verdon "
,CLOSED: Niger Investigation and Report,10:00AM,05/08/18," https://www.armed-services.senate.gov/hearings/18-05-08-niger-investigation-and-report "
,Department of Defense Budget Posture,09:30AM,04/26/18," https://www.armed-services.senate.gov/hearings/18-04-26-department-of-defense-budget-posture "
,Posture of the Department of the Air Force,09:30AM,04/24/18," https://www.armed-services.senate.gov/hearings/18-04-24-posture-of-the-department-of-the-air-force "
,Posture of the Department of the Navy,09:30AM,04/19/18," https://www.armed-services.senate.gov/hearings/18-04-19-posture-of-the-department-of-the-navy "
,Air Force Modernization,03:30PM,04/18/18," https://www.armed-services.senate.gov/hearings/18-04-18-air-force-modernization "
,Accelerating New Technologies to Meet Emerging Threats,02:30PM,04/18/18," https://www.armed-services.senate.gov/hearings/18-04-11-accelerating-new-technologies-to-meet-emerging-threats "
,Navy Shipbuilding Programs,02:30PM,04/17/18," https://www.armed-services.senate.gov/hearings/18-04-17-navy-shipbuilding-programs- "
,Nominations -- Davidson - O’Shaughnessy,09:30AM,04/17/18," https://www.armed-services.senate.gov/hearings/18-04-17-nominations_--davidson---oshaughnessy "
,Posture of the Department of the Army,09:30AM,04/12/18," https://www.armed-services.senate.gov/hearings/18-04-12-posture-of-the-department-of-the-army "
,"U.S. Nuclear Weapons Policy, Programs, and Strategy",02:30PM,04/11/18," https://www.armed-services.senate.gov/hearings/18-04-11-us-nuclear-weapons-policy-programs-and-strategy "
,Health of the Department of Defense Industrial Base and its Role in Providing Readiness to the Warfighter,02:30PM,04/11/18," https://www.armed-services.senate.gov/hearings/18-04-11-health-of-the-department-of-defense-industrial-base-and-its-role-in-providing-readiness-to-the-warfighter "
,United States Special Operations Command's Efforts to Transform the Force for Future Security Challenges,10:00AM,04/11/18," https://www.armed-services.senate.gov/hearings/18-04-11-united-states-special-operations-commands-efforts-to-transform-the-force-for-future-security-challenges "
,Posture of the United States Transportation Command,09:30AM,04/10/18," https://www.armed-services.senate.gov/hearings/18-04-10-posture-of-the-united-states-transportation-command "
,Ballistic Missile Defense Policies and Programs,02:30PM,03/22/18," https://www.armed-services.senate.gov/hearings/18-03-22-ballistic-missile-defense-policies-and-programs "
,Challenges in the Department of Energy’s Atomic Energy Defense Programs,10:00AM,03/22/18," https://www.armed-services.senate.gov/hearings/18-03-22-challenges-in-the-department-of-energys-atomic-energy-defense-programs "
,POSTPONED: Navy Shipbuilding Programs,12:00AM,03/21/18," https://www.armed-services.senate.gov/hearings/18-03-21-navy-shipbuilding-programs- "
,POSTPONED: Ballistic Missile Defense Policies and Programs,12:00AM,03/21/18," https://www.armed-services.senate.gov/hearings/18-03-21-ballistic-missile-defense-policies-and-programs "
,Marine Corps Ground Modernization,02:30PM,03/20/18," https://www.armed-services.senate.gov/hearings/18-03-20-marine-corps-ground-modernization "
,United States Strategic Command,09:30AM,03/20/18," https://www.armed-services.senate.gov/hearings/18-03-20-united-states-strategic-command "
,United States Pacific Command,09:30AM,03/15/18," https://www.armed-services.senate.gov/hearings/18-03-15-united-states-pacific-command "
,Department of Energy Atomic Energy Defense Activities and Programs,02:30PM,03/14/18," https://www.armed-services.senate.gov/hearings/18-03-14-department-of-energy-atomic-energy-defense-activities-and-programs "
,Cyber Posture of the Services,02:30PM,03/13/18," https://www.armed-services.senate.gov/hearings/18-03-13-cyber-posture-of-the-services "
,United States Central Command and United States Africa Command,09:30AM,03/13/18," https://www.armed-services.senate.gov/hearings/18-03-13-united-states-central-command-and-united-states-africa-command "
,Domestic Violence and Child Abuse in the Military,02:15PM,03/08/18," https://www.armed-services.senate.gov/hearings/18-03-08-domestic-violence-and-child-abuse-in-the-military "
,United States European Command,09:30AM,03/08/18," https://www.armed-services.senate.gov/hearings/18-03-08-united-states-european-command "
,Navy and Marine Corps Aviation Programs,02:30PM,03/06/18," https://www.armed-services.senate.gov/hearings/18-03-06-navy-and-marine-corps-aviation-programs "
,Worldwide Threats,09:30AM,03/06/18," https://www.armed-services.senate.gov/hearings/18-03-06-worldwide-threats "
,Nominations -- Nakasone - Park - White,09:30AM,03/01/18," https://www.armed-services.senate.gov/hearings/18-03-01-nominations_--nakasone---park---white "
,POSTPONED: Accelerating New Technologies to Meet Emerging Threats,02:30PM,02/27/18," https://www.armed-services.senate.gov/hearings/18-02-27-accelerating-new-technologies-to-meet-emerging-threats "
,United States Cyber Command,09:30AM,02/27/18," https://www.armed-services.senate.gov/hearings/18-02-27-united-states-cyber-command "
,United States Northern Command and United States Southern Command,09:30AM,02/15/18," https://www.armed-services.senate.gov/hearings/18-02-15-united-states-northern-command-and-united-states-southern-command "
,Military and Civilian Personnel Programs and Military Family Readiness,03:00PM,02/14/18," https://www.armed-services.senate.gov/hearings/18-02-14-military-and-civilian-personnel-programs-and-military-family-readiness "
,Current Readiness of U.S. Forces,02:30PM,02/14/18," https://www.armed-services.senate.gov/hearings/18-02-14-current-readiness-of-us-forces "
,Department of Defense’s role in Protecting Democratic Elections,02:30PM,02/13/18," https://www.armed-services.senate.gov/hearings/18-02-13-department-of-defenses-role-in-protecting-democratic-elections "
